{
 "language": "EN",
 "keyword_map": [
  {
   "keyword": "Python",
   "importance": "E",
   "support": 1,
   "evidence": "exp_insidetx_2 (plateforme Python/PostgreSQL/Streamlit), exp_sg_1 (Python, SQL)",
   "location": "Profil, Expérience, Compétences",
   "action": "En tête de la ligne Programming et dans le profil"
  },
  {
   "keyword": "statistical analyses / statistics",
   "importance": "E",
   "support": 1,
   "evidence": "exp_insidetx_3 : corrélations, régressions de tendance, bruit de mesure vs variabilité du procédé, alertes d'anomalies",
   "location": "Profil, exp_insidetx_3 (1re puce)",
   "action": "Puce reformulée « statistical analyses », placée en premier"
  },
  {
   "keyword": "machine learning",
   "importance": "E",
   "support": 1,
   "evidence": "exp_insidetx_4 : prototype DoE + processus gaussien avec active learning ; cours ENSEIRB AI (ML, deep learning) ; proj_rl (Double DQN, équipe de 6)",
   "location": "Profil, exp_insidetx_4, Compétences, Formation",
   "action": "« machine-learning model » dans la puce GP (prototype, jamais déployé) ; ML en tête de Quantitative Methods"
  },
  {
   "keyword": "probability",
   "importance": "E",
   "support": 2,
   "evidence": "Cours M2 : mathematical finance (stochastic calculus), computational finance (Monte Carlo)",
   "location": "Profil, Formation, Compétences",
   "action": "Mot cité dans le profil ; Monte Carlo et calcul stochastique en tête des cours"
  },
  {
   "keyword": "Master's degree in a quantitative field",
   "importance": "E",
   "support": 1,
   "evidence": "edu_m2 (MSc Applied Mathematics & Statistics) + edu_enseirb (Engineering Degree, Master's level, Data & AI), en cours",
   "location": "Profil, Formation",
   "action": "« MSc Applied Mathematics & Statistics » cité dans le profil (intitulé exact du diplôme, plus parlant pour l'offre) ; diplôme en cours"
  },
  {
   "keyword": "present technical findings clearly",
   "importance": "E",
   "support": 1,
   "evidence": "exp_insidetx_4 : présentation de LabData au comité de direction ; workshop IA interne",
   "location": "Profil, exp_insidetx_4",
   "action": "Mis en avant dans le profil (« findings presented to management »)"
  },
  {
   "keyword": "attention to detail / rigorous, methodical approach",
   "importance": "E",
   "support": 1,
   "evidence": "exp_insidetx_1 (fusionnée dans exp_insidetx_2) : validation indépendante, réconciliation (concordance totale), piste d'audit, 4 123 tests (91 %) ; exp_sg_2 (fusionnée dans exp_sg_1) : 25+ contrôles de qualité",
   "location": "exp_insidetx_2 (puce fusionnée), exp_sg_1",
   "action": "« rigorous validation » dans la puce LabData fusionnée"
  },
  {
   "keyword": "analytical and logical skills",
   "importance": "E",
   "support": 1,
   "evidence": "Top 3 % ENSEIRB, 1er en mathématiques en CPGE, couche d'analyse chez Inside Therapeutics",
   "location": "Profil, Formation",
   "action": "« top 3% » gardé en gras dans le profil ; 1er en mathématiques en CPGE dans la formation"
  },
  {
   "keyword": "align forecast runs from different sources / aggregated datasets",
   "importance": "E",
   "support": 3,
   "evidence": "exp_sg_1 (fusionnée avec exp_sg_2) : intégration de 6 sources de données en jeux de données contrôlés (données de marché, pas météo)",
   "location": "exp_sg_1",
   "action": "« quality-checked datasets » ; ne jamais écrire « forecast » ni « weather » pour SG ; projet proposé new:1 pour couvrir la météo"
  },
  {
   "keyword": "weather forecast runs / ensemble forecasts",
   "importance": "E",
   "support": 4,
   "evidence": "Aucun fait",
   "location": "—",
   "action": "Lacune : projet proposé new:1 (vérification et agrégation de runs ECMWF/GFS)"
  },
  {
   "keyword": "synthetic weather scenarios (generative ML)",
   "importance": "E",
   "support": 3,
   "evidence": "Monte Carlo (cours M2, simulation de scénarios) ; GP avec quantification d'incertitude (prototype) ; PyTorch dans les compétences — pas de modèle génératif",
   "location": "Compétences, exp_insidetx_4",
   "action": "Pas de « generative » sur le CV avant réalisation de new:2"
  },
  {
   "keyword": "time series",
   "importance": "D",
   "support": 2,
   "evidence": "skills_quant : time series ; régressions de tendance (exp_insidetx_3)",
   "location": "Compétences",
   "action": "Conservé dans Quantitative Methods"
  },
  {
   "keyword": "uncertainty / representativeness",
   "importance": "D",
   "support": 3,
   "evidence": "exp_insidetx_4 : active learning guidé par l'incertitude",
   "location": "exp_insidetx_4",
   "action": "Conservé tel quel"
  },
  {
   "keyword": "quantitative research experience (academic or project)",
   "importance": "D",
   "support": 2,
   "evidence": "Prototype GP (exp_insidetx_4), analyses statistiques (exp_insidetx_3), proj_rl (équipe de 6), proj_options",
   "location": "Expérience, Projets (new:1, new:2)",
   "action": "Démarche de recherche portée par les puces Inside Therapeutics ; proj_rl retiré de la page pour tenir sur une page, à citer en entretien"
  },
  {
   "keyword": "market-making / traders",
   "importance": "C",
   "support": 2,
   "evidence": "proj_rl (RL market making, équipe de 6) ; exp_sg_2 : dashboards pour les équipes Trading (jamais front office)",
   "location": "exp_sg_1 (Trading)",
   "action": "« Trading » cité en premier dans la puce SG fusionnée ; proj_rl (market making, équipe de 6) retiré de la page faute de place, à évoquer en entretien"
  },
  {
   "keyword": "short-term power markets / energy trading",
   "importance": "C",
   "support": 4,
   "evidence": "Aucun fait (expérience marchés de capitaux seulement)",
   "location": "—",
   "action": "Lacune : à préparer pour l'entretien (day-ahead/intraday EPEX, effet température/éolien/solaire sur les prix)"
  },
  {
   "keyword": "English (fluent)",
   "importance": "E",
   "support": 1,
   "evidence": "skills_languages : English (fluent, C1 – TOEIC 970/990)",
   "location": "Compétences",
   "action": "Inchangé"
  }
 ],
 "section_order": [
  "profile",
  "education",
  "experience",
  "projects",
  "skills"
 ],
 "bullet_order": [
  {
   "block_id": "exp_insidetx",
   "bullet_ids": [
    "exp_insidetx_3",
    "exp_insidetx_4",
    "exp_insidetx_2"
   ]
  },
  {
   "block_id": "exp_sg",
   "bullet_ids": [
    "exp_sg_1"
   ]
  }
 ],
 "removed_bullets": [
  "exp_sg_2",
  "exp_insidetx_1"
 ],
 "rewrites": [
  {
   "bullet_id": "exp_insidetx_3",
   "text": "Initiated **statistical analyses** (correlations, trend regressions, noise vs process variability, anomaly flags) for machine validation and tuning.",
   "reason": "Cœur de l'offre (analyse statistique), en premier ; raccourcie (−27 % vs maître, « parameter tuning » → « tuning ») pour gagner de la place, mêmes méthodes.",
   "keywords": [
    "statistical analyses",
    "regression",
    "anomaly"
   ]
  },
  {
   "bullet_id": "exp_insidetx_4",
   "text": "Prototyped a **machine-learning model** (DoE + Gaussian process) with uncertainty-driven active learning; presented LabData to the **executive committee**; ran an AI workshop.",
   "reason": "Machine learning explicite (prototype, jamais déployé) et présentation de résultats à la direction.",
   "keywords": [
    "machine learning",
    "uncertainty",
    "present findings"
   ]
  },
  {
   "bullet_id": "exp_insidetx_2",
   "text": "Built **LabData** solo (Python/PostgreSQL/Streamlit), live in **7 weeks**, saving 6 scientists **~2 h** per experiment; automated **~500 samples/month** with **rigorous validation**: reconciliation (full agreement), audit trail, **4,123 tests** (91% coverage).",
   "reason": "Fusion de exp_insidetx_1 (retirée) et exp_insidetx_2 : −40 % par rapport aux deux puces réunies ; tous les chiffres gardés (7 semaines, 6 scientifiques, ~2 h, ~500 échantillons/mois, 4 123 tests, 91 %), « rigorous validation » reprend l'exigence de rigueur. Les deux réalisations restent distinctes (point-virgule).",
   "keywords": [
    "Python",
    "rigorous",
    "validation",
    "attention to detail"
   ]
  },
  {
   "bullet_id": "exp_sg_1",
   "text": "Integrated **6 data sources** (Python, SQL) into quality-checked datasets for P&L tools; replaced manual checks with **25+ automated data-quality and compliance controls**, monitored in Power BI for **Trading**, Risk and Finance.",
   "reason": "Fusion des deux puces SG (exp_sg_2 retirée) : −19 % par rapport aux deux puces réunies, tous les faits et chiffres gardés ; Trading en premier.",
   "keywords": [
    "data sources",
    "datasets",
    "data quality",
    "Trading"
   ]
  }
 ],
 "field_rewrites": [
  {
   "block_id": "skills_quant",
   "field": "content",
   "text": "machine learning, regression, time series, Monte Carlo, stochastic calculus, deep RL.",
   "reason": "Machine learning et régression en premier, comme dans l'offre ; aucune compétence ajoutée.",
   "keywords": [
    "machine learning",
    "regression",
    "time series",
    "Monte Carlo"
   ]
  },
  {
   "block_id": "skills_programming",
   "field": "content",
   "text": "Python (pandas, NumPy, scikit-learn, PyTorch, Streamlit), SQL (PostgreSQL), C++, R, C, VBA. Tools: Git, Bash/Linux, Power BI, Excel, Claude Code.",
   "reason": "Python et SQL en tête ; Java et TypeScript retirés (peu étayés), « AI-assisted development » abrégé en « Claude Code » : −23 % pour gagner une ligne.",
   "keywords": [
    "Python",
    "SQL"
   ]
  },
  {
   "block_id": "skills_finance",
   "field": "content",
   "text": "derivatives, P&L, VaR/ES, stress testing, backtesting, options pricing (Black–Scholes, Greeks), fixed income.",
   "reason": "Dérivés et P&L en tête (contexte trading) ; « Expected Shortfall » abrégé en ES ; delta hedging, Basel III/FRTB et Solvency II retirés (hors sujet, place).",
   "keywords": [
    "derivatives",
    "P&L"
   ]
  },
  {
   "block_id": "edu_m2",
   "field": "extra",